question,ground_truth,answer,contexts,faithfulness,answer_relevancy,context_precision,context_relevancy,context_recall,context_entity_recall,answer_similarity,answer_correctness
How can you prevent getting lost using the map?,Press the right analog stick to fix the map orientation to always point north.,"According to the text, you can prevent getting lost on the map by pressing the right analog stick, which will make the map always point north. This will help you navigate the map more easily and avoid getting disoriented.","['This\npokemon\ngame\nis\nset\nin\nthe\nregion\nof\nPaldea,\nafter\na\ngood\namount\nof\ntalking\nthrough\nthe\nbeginning\nof\nthe\ngame\nyou\nwill\nfind\nthere\nare\nthree\nmain\nstory-lines\nor\nQuests\nto\naccomplish,\nand\nthey\ncan\nbe\ndone\nin\nany\norder\nat\nany\ntime.\nThe\ngame\nallows\nyou\nto\njust\ngo\nexplore\nthe\nworld\nat\nyour\nown\npace.\nThis\ncan\nbe\na\nlittle\nconfusing\nthough\nsince\nit\ndoesn’t\ngive\nyou\na\nlot\nof\ndirection\nabout\nwhere\nto\ngo\nnext\nor\nwho\nto\nfight\nin\nwhat\norder,\nso\nI’m\ngoing\nto\nbreak\nit\ndown\nby\neach\nQuest\nline\nby\nthe\norder\nin\nwhich\nthey\nmight\nbe\neasiest\nto\nhardest\nto\nfight\n(you\ndon’t\nhave\nto\nfight\nthem\nin\nthe\norder\nI\nsuggest,\nI\ndid\nit\ncompletely\nout\nof\norder\nand\nwas\nfine,\nthough\nit\nwas\ntricky.)\nI\nalso\nsuggest\nhopping\nbetween\nthe\nthree\nstories\nas\nyou\ngo,\nsince\nmany\nof\nthem\nmight\nbe\nclose\nto\neach\nother,either\non\nthe\nmap\nor\nin\nlevel,\nso\ndon’t\nworry\nabout\ngoing\nfrom\none\nstory\nto\nanother,\nit’s\nall\nabout\nhaving\nfun.\nNow\nall\nthat\ntalking\nin\nthe\ntutorial\nstuff\nis\ndone.\nSome\nquick\ntips:\nMAP\nWhen\nyou\nopen\nyour\nmap,\nyou\nmight\nnotice\nit\ncan\nspin\naround,\nwhich\nis\nvery\ndisorienting.\nTo\nprevent\nthis,\npress\nthe\nright\nanalog\nstick\nand\nit\nwill\nmake\nthe\nmap\nalways\npoint\nnorth,\nwhich\nhelped\nme\na\nton\nto\nSTOP\ngetting\nlost\nall\nthe\ntime.', 'Go\nto\nas\nmany\npokemon\ncenters,\nand\nmysterious\ntowers\nas\nyou\ncan,\nunlock\nfast\ntravel\nFast\ntravel\nis\nunlocked\nimmediately\nin\nthe\ngame.\nAll\npokemon\ncenters\nare\nfast\ntravel\nlocations.\nAlso\nif\nyou\nsee\na\nmysterious\ntower\nwhile\nyou’re\nwalking\naround,\nit’s\nprobably\nalso\na\nhidden\nfast\ntravel\nlocation,\nif\nyou\nclimb\nto\nthe\ntop\nof\nit\nyou\ncould\nunlock\na\nspot\nto\nfly\nto.\nAlso\nthere\nmight\nbe\na\nlittle\ngimmighoul\nthere\nto\ncollect\ncoins\nfrom.\nYou\nhave\nto\ntalk\nto\nthe\nother\ntrainers\nto\nbattle\nthem!\nUnlike\nin\npast\ngames,\nwhere\nthey\njust\nhad\nto\nlook\nat\nyou\nto\nfight,\nyou\nnow\nhave\nto\ngo\nup\nand\ntalk\nto\nthe\ntrainers\nto\nfight\nthem.\nI\nstill\nsuggest\nbattling\neveryone,\nsince\nyou\nget\nreally\nnice\nrewards\nfrom\nthe\npokemon\nrepresentatives\nat\nthe\npokemon\ncenters\nif\nyou\nbattle\na\ncertain\nnumber\nof\ntrainers\nin\nan\narea.\nIf\nyou’re\nnot\nsure\nif\nyou’ve\nfought\nsomeone\nor\nnot\nyet,\nthey\nwill\nhave\na\nyellow\ntext\nbubble\nover\ntheir\nhead\nif\nyou\nhave\nnot\nfought\nthem,\nif\nyou\nhave\nthey\nwill\nremain\nquiet.\nPick\nup\nitems:\nYou\nwill\nnotice\npokeballs\nor\nshiny\nthings\nin\nthe\nworld,\nregular\nitems,\nthings\nto\npick\nup,\nEVERYWHERE.\nDon’t\nworry\ntoo\nmuch\nthough,\nsince\nthey\ndo\nrespawn,\nso\ndon’t\nworry\ntoo\nmuch\nabout\nmissing\nout\non\nthis\nrare\nitem\nor\nthat\nspecial\nTM.\nThey\nreally\nare\neverywhere,\nbut\nit’s\nalso\nfree\nstuff\nand\nmoney\nand\nmoney\nis\nhard\nto\nget\nin\nthis\ngame.\nUse\nyour\npicnics:\nSomething\nI\ndidn’t\nunderstand\nuntil\nway\nlater\nin\nthe\ngame\nis\nhow\nuseful\nthe\nsandwich\nbuffs\ncan\nbe.\nFor\nexample,\nif\nyou\nwant\nto\nlevel\nup\nfaster,\nor\nmake\nsure\nyou\ncapture\nthat\nlegendary,\nyou\ncan\neat\na\nsandwich\nto\nhelp\nwith\nthat.\nA\ntechnique\na\nton\nof\npeople\nuse,\nis\nin\nthe\nfar\nnorthwestern\ncorner\nof\nthe\nmap\nby\nthe\nTeam\nStar-fairy\nmember,\nChansey\ncan\nspawn,\nand\nChansey\ngives\na\nlot\nof\nexp\nif\nyou\nKO\nit.\nPeople\nwill\neat\na\nHam\nSandwich\n(#80)\nto\nincrease\nNormal\nencounter\nrates,\nto\nsee\na\nlot\nof\nchansey’s\nto\npower\nlevel\ntheir\npokemon\nfor\nthe\nElite\nfour\nat\nthe\nend\nof\nthe\ngame.\nAll\nSandwich\nAbilities\n:\n-\nSandwich\nduration\n-\n30\nmin.\n●\nEgg\nPower:\nIncreased\nchance\nto\nfind\nPokemon\nEggs\n●\nCatching\nPower\n:\nIncreased\nchance\nthat\ncaptures\nwill\nsucceed\n●\nExp.\nPoint\nPower:\nMore\nExp.\nPoints\ngained\n●\nItem\nDrop\nPower\n:\nMore\nmaterials\nfound\nafter\nbattles\n●\nTitle\nPower:\nMore\nlikely\nto\nfind\nPokemon\nwith\ntitles\n●\nSparkling\nPower:\nMore\nlikely\nto\nfind\nShiny\nPokemon\n●\nHumungo\nPower:\nMore\nlikely\nto\nfind\nlarge\nPokemon', ""All\npokemon\nCenters\nare\nalso\nFast\nTravel\nlocations,\nbut\nsome\nspecial\nLandmarks\nmust\nbe\nunlocked\nby\ntraveling\nto\nthem\nand\nlooking\nat\nthe\nsights\nor\nclimbing\na\nmountain\nor\nreading\na\nsign.\nSome\nare\nalso\nat\nthe\ntop\nof\nthe\nWatchtowers.\nWatchtowers\nare\nwhere\nto\ngo\nﬁnd\ngimmighoul’s\nin\ntheir\nchest\nform\nand\nhow\nyou\nwill\nget\nmany\ncoins\nfrom\nthem\nor\ncatch\none\nto\neventually\nget\nyourself\na\nGholdengo.\nLet's\ntalk\nabout\nsome\nof\nthese\nSpecial\nnew\npokemon!"", 'Victory\nRoad\nThe\nPokemon\nLeague\n-\nDefeating\nThe\nElite\nFour\nHow\nto\nFind\nthe\nPokemon\nLeague\nIt’s\nlocated\nin\nthe\nback\nof\nMesagoza,\nin\nthe\nNorthwest\ncorner.\nYou\nare\nlooking\nfor\na\ngate\nand\ntunnel\npictured\nbelow\nbehind\nsome\nbuildings.\nFollow\nthe\ngrass\nto\nthe\npokemon\ncenter,\nﬁght\nthe\ntrainers\nif\nyou\nwant\nto.\nWhen\nyou\nenter\nthe\ngym-like\nbuilding\nin\nthe\nback\nthe\nchallenge\nis\non,\nso\nbe\nready!\nPrepare\nwith\nthese\ntypes\nof\npokemon:\n \nF o r\nt h e\nﬁ r s t\nb a t t l e :\nGrass,\nGround,\nIce\nand\nPsychic-type\n \nF o r\nt h e\ns e c o n d\nb a t t l e :\nFire,\nGround,\nFighting,\nDark,\nGhost\nand\nElectric-type\n \nF o r\nt h e\nt h i r d\nb a t t l e :\nRock,\nElectric,\nIce,\nDragon,\nand\nFairy-type\n \nF o r\nt h e\nf o u r t h\nb a t t l e :\nIce,\nFairy,\nand\nDragon-type\n \nF o r\nt h e\nﬁ f t h\nb a t t l e :\nDark,\nGhost,\nElectric,\nFighting,\nFire,\nGround,\nand\nWater-type\nI\nknow\nit\nlooks\noverwhelming,\nbut\nyou\ndon’t\nhave\nto\nhave\nall\nthose\ntypes,\njust\nhaving\nsome\ndi\x00erent\nmoves\nworks\nwell,\nlike\nghost\nmoves\non\nyour\ndark\ntype\nor\nﬁghting\nor\nground\ntypes\nmoves,\neven\nif\nthe\npokemon\nis\nnot\nthat\ntype\nis\nenough.']",1.0,0.982608753554441,0.9999999999,0.002171552660152009,1.0,0.0,0.9255518210329623,0.6063879552582405
How can you earn more LP in the game?,LP can be earned through Tera Raid Battles and is used for buying items and making TMs.,"According to the provided context, you can earn more LP by participating in Tera Raids. Tera Raids are similar to Max Raid Battles, and they are a way to get more LP and possibly obtain strong, unique Pokémon.","['●\nTeensy\nPower\n:\nMore\nlikely\nto\nfind\nsmall\nPokemon\n●\n(Type)\nEncounter\nPower\n:\nMore\nlikely\nto\nfind\n(Type)\nPokemon\n●\nRaid\nPower:\nEarn\nmore\nitems\nin\nTera\nRaid\nBattles\nEgg\nPower\nwill\nbe\nimportant\nwhen\nyou\nwant\nto\nstart\nbreeding\nsince\nin\nthis\ngame,\nyou\nbreed\nby\nhaving\na\nditto,\nand\none\nother\npokemon\nin\nyour\nparty\nin\na\npicnic\nand\nyou\ncheck\nthe\nsmall\npicnic\nbasket\nnext\nto\nthe\ntable\nevery\nso\noften\nto\nsee\nif\nyou\nhave\nany\neggs,\nif\nyou\nhave\nmany\neggs\nthey\nwill\njust\ngo\nto\nyour\nboxes.\n(Egg\npower\n2\ngot\nme\nabout\n30\neggs\nin\n30\nmin).\nWhat\nis\nthe\ndifference\nbetween\nLP\nand\nCash?\nNot\nmuch,\nyou\ncan\nus\neither\nin\nshops,\nbut\nyou\ncan\nonly\nus\nLP\nto\nmake\nTM’s\nat\nthe\n™\nmachine.\nI\nalso\nconsidered\nusing\nit\nas\na\nway\nto\nmake\nextra\ncash,\nif\nyou\nused\nall\nthe\npokemon\ningredients\nyou\nget\nand\nthe\nLP\nand\nthen\nsold\nsome\nhigh\nlevel\n™’s\nthen\nyou\ncould\nmake\na\nlot\nof\ncash.\nBut\nin\nthe\nend\nshould\nyou\nuse\nLP\nor\ncash\nat\nthe\nstores,\nuse\neither,\nor\nwhichever\nyou\nhave\nmore\nof.\nI\nfound\nI\nspent\na\nlot\nof\nmy\nLP\nin\nearly\nsince\nI\nseemed\nto\nhave\nmore\nof\nit\nand\nI\ncouldn’t\nmake\nany\n™’s\nanyway.\nIt\nwas\na\ngood\nway\nto\nkeep\nme\nwell\nstocked\nup\non\nlots\nof\npokeballs\nand\ngreatballs.\nTera\nRaids:\nSimilar\nto\nMax\nRaid\nBattles,\nTera\nRaids\nare\nhow\nyou\nget\nmore\nLP\nand\nalso\nhow\nyou\ncan\nget\nsome\npretty\nstrong\nunique\npokemon.\nYou\nwill\nsee\na\nglowing\ncrystal\nin\nthe\ndistance,\nthey\nalso\nappear\non\nyour\nmap.\nIntro\nto\nthe\nGame\nDo\nthe\ntutorial,\nget\nyour\nfirst\npokemon,\nmeet\nyour\nnew\nbest\nfriend/rival.\nThen\nthe\ngame\nbacks\noff\na\nlittle\nand\nlets\nyou\nexplore,\nI\nthink\nI\nspent\nway\ntoo\nlong\njust\nexploring\nin\nthis\nfirst\nzone,\nbut\nit\nwas\njust\nso\nfun,\nso\nI’ll\npoint\nout\nsome\nthings\nyou\ncan\ncollect\nin\nthis\nfirst\nzone!\nPossible\nteam\npokemon:\nFidough,\nThe\nnew\nPaldea\nWooper,\nHoundour,\nFletchling,\nRalts,\nGhastly\nwill\nappear\nat\nnight.\nAll\nthese\nare\npretty\ngood\nto\nget\nearly\nand\nfire\npokemon\ncan\nbe\ntough\nto\nget\nearly.\nThere\nis\nalso\nCharcadet,\nthe\nnew\nfire\npokemon\nof\nthis\ngame\nyou\ncan\nget\nright\nafter\nyou\nfinish\ntalking\nto\neveryone\nin\nthe\nschool.\nSo\ntry\nto\nthink\nabout\nhow\nyou\nmight\nwant\nto\nbuild\nyour\nteam,\nsince\nyou\nwill\nprobably\nwant\nsomeone\nwith\nfire,\nwater,\nelectric\netc.\nEspecially\nsince\nthe\nfirst\ntwo\ngyms\nare\nweak\nto\nfire.', 'Go\nto\nas\nmany\npokemon\ncenters,\nand\nmysterious\ntowers\nas\nyou\ncan,\nunlock\nfast\ntravel\nFast\ntravel\nis\nunlocked\nimmediately\nin\nthe\ngame.\nAll\npokemon\ncenters\nare\nfast\ntravel\nlocations.\nAlso\nif\nyou\nsee\na\nmysterious\ntower\nwhile\nyou’re\nwalking\naround,\nit’s\nprobably\nalso\na\nhidden\nfast\ntravel\nlocation,\nif\nyou\nclimb\nto\nthe\ntop\nof\nit\nyou\ncould\nunlock\na\nspot\nto\nfly\nto.\nAlso\nthere\nmight\nbe\na\nlittle\ngimmighoul\nthere\nto\ncollect\ncoins\nfrom.\nYou\nhave\nto\ntalk\nto\nthe\nother\ntrainers\nto\nbattle\nthem!\nUnlike\nin\npast\ngames,\nwhere\nthey\njust\nhad\nto\nlook\nat\nyou\nto\nfight,\nyou\nnow\nhave\nto\ngo\nup\nand\ntalk\nto\nthe\ntrainers\nto\nfight\nthem.\nI\nstill\nsuggest\nbattling\neveryone,\nsince\nyou\nget\nreally\nnice\nrewards\nfrom\nthe\npokemon\nrepresentatives\nat\nthe\npokemon\ncenters\nif\nyou\nbattle\na\ncertain\nnumber\nof\ntrainers\nin\nan\narea.\nIf\nyou’re\nnot\nsure\nif\nyou’ve\nfought\nsomeone\nor\nnot\nyet,\nthey\nwill\nhave\na\nyellow\ntext\nbubble\nover\ntheir\nhead\nif\nyou\nhave\nnot\nfought\nthem,\nif\nyou\nhave\nthey\nwill\nremain\nquiet.\nPick\nup\nitems:\nYou\nwill\nnotice\npokeballs\nor\nshiny\nthings\nin\nthe\nworld,\nregular\nitems,\nthings\nto\npick\nup,\nEVERYWHERE.\nDon’t\nworry\ntoo\nmuch\nthough,\nsince\nthey\ndo\nrespawn,\nso\ndon’t\nworry\ntoo\nmuch\nabout\nmissing\nout\non\nthis\nrare\nitem\nor\nthat\nspecial\nTM.\nThey\nreally\nare\neverywhere,\nbut\nit’s\nalso\nfree\nstuff\nand\nmoney\nand\nmoney\nis\nhard\nto\nget\nin\nthis\ngame.\nUse\nyour\npicnics:\nSomething\nI\ndidn’t\nunderstand\nuntil\nway\nlater\nin\nthe\ngame\nis\nhow\nuseful\nthe\nsandwich\nbuffs\ncan\nbe.\nFor\nexample,\nif\nyou\nwant\nto\nlevel\nup\nfaster,\nor\nmake\nsure\nyou\ncapture\nthat\nlegendary,\nyou\ncan\neat\na\nsandwich\nto\nhelp\nwith\nthat.\nA\ntechnique\na\nton\nof\npeople\nuse,\nis\nin\nthe\nfar\nnorthwestern\ncorner\nof\nthe\nmap\nby\nthe\nTeam\nStar-fairy\nmember,\nChansey\ncan\nspawn,\nand\nChansey\ngives\na\nlot\nof\nexp\nif\nyou\nKO\nit.\nPeople\nwill\neat\na\nHam\nSandwich\n(#80)\nto\nincrease\nNormal\nencounter\nrates,\nto\nsee\na\nlot\nof\nchansey’s\nto\npower\nlevel\ntheir\npokemon\nfor\nthe\nElite\nfour\nat\nthe\nend\nof\nthe\ngame.\nAll\nSandwich\nAbilities\n:\n-\nSandwich\nduration\n-\n30\nmin.\n●\nEgg\nPower:\nIncreased\nchance\nto\nfind\nPokemon\nEggs\n●\nCatching\nPower\n:\nIncreased\nchance\nthat\ncaptures\nwill\nsucceed\n●\nExp.\nPoint\nPower:\nMore\nExp.\nPoints\ngained\n●\nItem\nDrop\nPower\n:\nMore\nmaterials\nfound\nafter\nbattles\n●\nTitle\nPower:\nMore\nlikely\nto\nfind\nPokemon\nwith\ntitles\n●\nSparkling\nPower:\nMore\nlikely\nto\nfind\nShiny\nPokemon\n●\nHumungo\nPower:\nMore\nlikely\nto\nfind\nlarge\nPokemon', 'Gym\nChallenge\nMission\nHere\nis\na\nsimple\nrun\ndown\nof\nthe\ngyms.\nT o w n\nN a m e\nL e a d e r\nn a m e\nT y p e\nL e v e l\nCortondo\nGym\nKaty\nBug\n14-15\nArtazon\nGym\nBrassius\nGrass\n16-17\nLevinicia\nGym\nIono\nElectric\n23-24\nCascarrafa\nGym\nKofu\nWater\n29-30\nMedali\nGym\nLarry\nNormal\n35-36\nMontenevera\nGym\nRyme\nGhost\n41-42\nAlfornada\nGym\nTulip\nPsychic\n44-45\nGlaseado\nGym\nGrusha\nIce\n47-48', 'How\nto\nget\nSpecial\nitems:\nYou\ncan\nget\nlucky\nand\nﬁnd\nthe\nChipped/Cracked\nPot\non\nthe\nground\nas\none\nof\nthe\nmany\npokeballs\non\nthe\nground,\nas\nwell\nas\nsweet\nor\ntart\napples.\nAlso\ncheck\nthe\nauctions\nin\nP o r t o\nM a r i n a d a .\nThey\nwill\nupdate\neveryday\nand\nusually\nhave\na\nspecial\nitem\nsuch\nas\nthe\nRotom\ncatalog.\nHow\nto\nget\nAuspicious\nArmor\n-\nScarlet:\nI n\nZ a p i c i c o ,\nn e a r\nw h e r e\nt h e\nP o i s o n\nT e a m\nS t a r\nM e m b e r\nh a n g s\no u t\n,\nyou\ncan\ntrade\nwith\na\nnice\ngentlemen\nwho\nrequests\n1 0\nB r o n z o r\nF r a g m e n t s\n.\nYou\ncan\ngather\nthose\nback\nin\nthe\ndesert\nwhere\nthe\nTinkatu\x00s\nare.\nHave\nyour\npokemon\nauto-ﬁght\nbronzors\nuntil\nyou\nhave\n10\nfragments\nand\ngive\nthem\nto\nthe\nguy\nand\nget\nthe\narmor.\nHow\nto\nget\nMalicious\nArmor\n-\nViolet\n:\nIn\nZapicico,\njust\nthe\nsame\nas\nin\nScarlet\na\nwomen\nwill\nask\nfor\n1 0\nS i n i s t e a\nF r a g m e n t s\n.\nYou\ncan\nﬁnd\nSinisteas\naround\nTulips\nPsychic\nGym\nin\nAlfornada.\nPokemon\nthat\nrequire\nSpecial\nBattle\nconditions\nto\nevolve:\n●\nPrimeape\n+\nuse\nRage\nFist\n20\ntimes\n=\nAnnihilape\n●\nBisharp\n+\nholding\nLeader’s\nCrest\n+\nbeat\n3\nother\nBisharp\nwith\nLeader’s\nCrest\nin\nbattle\n=\nKingambit\nPokemon\nthat\nrequire\nMultiplayer:\n●\nFinizen\n+\nBecomes\nlevel\n38\n(or\nhigher)\nwhile\nin\nmultiplayer\n=\nPalaﬁn']",0.3333333333333333,1.0000000000000009,0.9999999999,0.0017730496453900709,1.0,0.6666666644444444,0.90115269913228,0.6538596033544986
